{
  "$schema": "./theme.schema.json",
  "meta": {
    "name": "CU Ways Rose × Slate",
    "version": "1.7.0",
    "status": "Second manual-review batch; research-informed composition and status placement; human color judgment pending",
    "source": "../US-025/color-playground/round-10.html",
    "sourceSha256": "292ada478cceedd916b43214ea26d855b01b6ef4ce7f9851b3a9c39150a45900",
    "decisionDate": "2026-10-30",
    "latestDecision": "Upper-right entity statuses; faint option dividers; aligned empty states; compact review history/disclosure and cancellation composition",
    "frontendInspected": "3e8a041ed48bc4d613afe7d6d6e1049a3edb8cde",
    "backendInspected": "439590f8132e8a3f1a47aa4cd4f19aa12214a19a",
    "sourceRole": "Selected Round10 appearance is the visual reference. Later user corrections remove the header top rim and define contextual navigation; do not dismiss the reference because its files are historical."
  },
  "shared": {
    "rim.highlight": {
      "$type": "dimension",
      "$value": "2px",
      "$status": "approved",
      "$description": "Shared rim / highlight parameter. Inherit unless a scoped, documented specialization is needed; this is not a page coordinate."
    },
    "rim.seam": {
      "$type": "dimension",
      "$value": "1px",
      "$status": "approved",
      "$description": "Shared rim / seam parameter. Inherit unless a scoped, documented specialization is needed; this is not a page coordinate."
    },
    "border.hairline": {
      "$type": "dimension",
      "$value": "1px",
      "$status": "approved",
      "$description": "Shared border / hairline parameter. Inherit unless a scoped, documented specialization is needed; this is not a page coordinate."
    },
    "radius.headerLower": {
      "$type": "dimension",
      "$value": "10px",
      "$status": "approved",
      "$description": "Shared radius / headerLower parameter. Inherit unless a scoped, documented specialization is needed; this is not a page coordinate."
    },
    "radius.bottomUpper": {
      "$type": "dimension",
      "$value": "12px",
      "$status": "approved",
      "$description": "Shared radius / bottomUpper parameter. Inherit unless a scoped, documented specialization is needed; this is not a page coordinate."
    },
    "radius.actionTray": {
      "$type": "dimension",
      "$value": "16px",
      "$status": "approved",
      "$description": "Shared radius / actionTray parameter. Inherit unless a scoped, documented specialization is needed; this is not a page coordinate."
    },
    "radius.action": {
      "$type": "dimension",
      "$value": ".625rem",
      "$status": "guidance",
      "$description": "Scales with text/root size; validate intrinsic sizing and zoom."
    },
    "radius.card": {
      "$type": "dimension",
      "$value": ".75rem",
      "$status": "guidance",
      "$description": "Scales with text/root size; validate intrinsic sizing and zoom."
    },
    "radius.status": {
      "$type": "dimension",
      "$value": ".25em",
      "$status": "guidance",
      "$description": "Scales with text/root size; validate intrinsic sizing and zoom."
    },
    "size.targetMin": {
      "$type": "dimension",
      "$value": "2.75rem",
      "$status": "guidance",
      "$description": "Scales with text/root size; validate intrinsic sizing and zoom."
    },
    "size.actionMin": {
      "$type": "dimension",
      "$value": "3rem",
      "$status": "guidance",
      "$description": "Scales with text/root size; validate intrinsic sizing and zoom."
    },
    "size.navRowMin": {
      "$type": "dimension",
      "$value": "4rem",
      "$status": "guidance",
      "$description": "Scales with text/root size; validate intrinsic sizing and zoom."
    },
    "size.navIconSlot": {
      "$type": "dimension",
      "$value": "1.375rem",
      "$status": "guidance",
      "$description": "Scales with text/root size; validate intrinsic sizing and zoom."
    },
    "space.actionInline": {
      "$type": "dimension",
      "$value": "1.125em",
      "$status": "guidance",
      "$description": "Scales with text/root size; validate intrinsic sizing and zoom."
    },
    "space.actionBlock": {
      "$type": "dimension",
      "$value": ".65em",
      "$status": "guidance",
      "$description": "Scales with text/root size; validate intrinsic sizing and zoom."
    },
    "space.iconGap": {
      "$type": "dimension",
      "$value": ".5em",
      "$status": "guidance",
      "$description": "Scales with text/root size; validate intrinsic sizing and zoom."
    },
    "space.navIconLabelGap": {
      "$type": "dimension",
      "$value": ".25rem",
      "$status": "guidance",
      "$description": "4px baseline gap between mobile icon and caption, independent of caption font size."
    },
    "space.trayInset": {
      "$type": "dimension",
      "$value": ".75rem",
      "$status": "guidance",
      "$description": "Scales with text/root size; validate intrinsic sizing and zoom."
    },
    "space.trayPadding": {
      "$type": "dimension",
      "$value": ".5rem",
      "$status": "guidance",
      "$description": "Scales with text/root size; validate intrinsic sizing and zoom."
    },
    "space.trayGap": {
      "$type": "dimension",
      "$value": ".75rem",
      "$status": "guidance",
      "$description": "Scales with text/root size; validate intrinsic sizing and zoom."
    },
    "space.contentClearance": {
      "$type": "dimension",
      "$value": "1.25rem",
      "$status": "guidance",
      "$description": "Scales with text/root size; validate intrinsic sizing and zoom."
    },
    "motion.lift": {
      "$type": "dimension",
      "$value": "1px",
      "$status": "approved",
      "$description": "Interaction motion lift. Durations are milliseconds; reduced motion removes decorative movement."
    },
    "focus.width": {
      "$type": "dimension",
      "$value": "3px",
      "$status": "guidance",
      "$description": "Shared focus / width parameter. Inherit unless a scoped, documented specialization is needed; this is not a page coordinate."
    },
    "focus.offset": {
      "$type": "dimension",
      "$value": "3px",
      "$status": "guidance",
      "$description": "Shared focus / offset parameter. Inherit unless a scoped, documented specialization is needed; this is not a page coordinate."
    },
    "motion.action.duration": {
      "$type": "duration",
      "$value": 150,
      "$status": "approved",
      "$description": "Interaction motion action.duration. Durations are milliseconds; reduced motion removes decorative movement."
    },
    "motion.navigation.duration": {
      "$type": "duration",
      "$value": 240,
      "$status": "approved",
      "$description": "Interaction motion navigation.duration. Durations are milliseconds; reduced motion removes decorative movement."
    },
    "motion.feedback.duration": {
      "$type": "duration",
      "$value": 140,
      "$status": "approved",
      "$description": "Interaction motion feedback.duration. Durations are milliseconds; reduced motion removes decorative movement."
    },
    "text.body": {
      "$type": "dimension",
      "$value": "1rem",
      "$status": "guidance",
      "$description": "Shared text / body parameter. Inherit unless a scoped, documented specialization is needed; this is not a page coordinate."
    },
    "text.caption": {
      "$type": "dimension",
      "$value": ".875rem",
      "$status": "guidance",
      "$description": "Shared text / caption parameter. Inherit unless a scoped, documented specialization is needed; this is not a page coordinate."
    },
    "text.back": {
      "$type": "dimension",
      "$value": "1rem",
      "$status": "guidance",
      "$description": "Shared text / back parameter. Inherit unless a scoped, documented specialization is needed; this is not a page coordinate."
    },
    "text.lineBody": {
      "$type": "number",
      "$value": 1.55,
      "$status": "guidance",
      "$description": "Shared text / lineBody parameter. Inherit unless a scoped, documented specialization is needed; this is not a page coordinate."
    },
    "text.lineLabel": {
      "$type": "number",
      "$value": 1.25,
      "$status": "guidance",
      "$description": "Shared text / lineLabel parameter. Inherit unless a scoped, documented specialization is needed; this is not a page coordinate."
    },
    "text.weight.action": {
      "$type": "number",
      "$value": 600,
      "$status": "approved",
      "$description": "Shared text / weight / action parameter. Inherit unless a scoped, documented specialization is needed; this is not a page coordinate."
    },
    "text.weight.back": {
      "$type": "number",
      "$value": 400,
      "$status": "approved",
      "$description": "Shared text / weight / back parameter. Inherit unless a scoped, documented specialization is needed; this is not a page coordinate."
    },
    "text.weight.navRest": {
      "$type": "number",
      "$value": 600,
      "$status": "approved",
      "$description": "Shared text / weight / navRest parameter. Inherit unless a scoped, documented specialization is needed; this is not a page coordinate."
    },
    "text.weight.navSelectedMobile": {
      "$type": "number",
      "$value": 700,
      "$status": "approved",
      "$description": "Shared text / weight / navSelectedMobile parameter. Inherit unless a scoped, documented specialization is needed; this is not a page coordinate."
    },
    "text.weight.navDesktop": {
      "$type": "number",
      "$value": 600,
      "$status": "approved",
      "$description": "Shared text / weight / navDesktop parameter. Inherit unless a scoped, documented specialization is needed; this is not a page coordinate."
    },
    "motion.navigationEase": {
      "$type": "string",
      "$value": "cubic-bezier(.22,.8,.25,1)",
      "$status": "approved",